{
  "schema_version": 2,
  "tool": {
    "name": "zombiescan",
    "version": "0.1.0"
  },
  "packs": [
    {
      "name": "core",
      "version": "0.1.0",
      "description": "Unattached, idle and orphaned resources across EC2, RDS, S3, CloudWatch, KMS, ECR and friends.",
      "api_version": 1,
      "source": "built-in",
      "homepage": "https://github.com/xbill9/zombiescan"
    },
    {
      "name": "lightsail",
      "version": "0.1.0",
      "description": "Stopped instances, unattached disks and static IPs, idle container services and orphaned snapshots in Lightsail.",
      "api_version": 1,
      "source": "built-in",
      "homepage": "https://github.com/xbill9/zombiescan"
    }
  ],
  "scan": {
    "generated": "2026-09-21T16:13:39Z",
    "duration_seconds": null,
    "account_id": "106059658660",
    "caller_arn": "arn:aws:iam::106059658660:root",
    "regions": [
      "ap-northeast-1",
      "ap-northeast-2",
      "ap-northeast-3",
      "ap-south-1",
      "ap-southeast-1",
      "ap-southeast-2",
      "ca-central-1",
      "eu-central-1",
      "eu-north-1",
      "eu-west-1",
      "eu-west-2",
      "eu-west-3",
      "sa-east-1",
      "us-east-1",
      "us-east-2",
      "us-west-1",
      "us-west-2"
    ],
    "pairs_attempted": 478,
    "pairs_unavailable": 12,
    "complete": true
  },
  "pricing": {
    "generated": "2026-09-21T15:33:49Z",
    "basis": "AWS Price List API, on-demand USD list prices",
    "excludes": [
      "savings plans",
      "reserved capacity",
      "private pricing",
      "credits"
    ]
  },
  "totals": {
    "monthly_cost": 6.9,
    "annual_cost": 82.8,
    "finding_count": 120,
    "by_check": {
      "ecr-stale-images": {
        "count": 33,
        "monthly_cost": 6.4
      },
      "unused-route53-zone": {
        "count": 1,
        "monthly_cost": 0.5
      },
      "empty-vpc": {
        "count": 1,
        "monthly_cost": 0.0
      },
      "log-group-no-retention": {
        "count": 67,
        "monthly_cost": 0.0
      },
      "unused-security-group": {
        "count": 18,
        "monthly_cost": 0.0
      }
    }
  },
  "findings": [
    {
      "check": "ecr-stale-images",
      "resource_id": "ai-course-creator-app",
      "resource_type": "ecr-repository",
      "region": "us-east-1",
      "reason": "26 image(s) holding up to 5.21 GB; nothing pushed in 160 days, 25 untagged",
      "monthly_cost": 0.52,
      "approximate_cost": true,
      "remediation": "aws ecr describe-images --repository-name ai-course-creator-app --region us-east-1  # review, then delete the tags you do not need and add a lifecycle policy so they do not come back",
      "details": {
        "image_count": 26,
        "untagged_count": 25,
        "total_gb": 5.21,
        "newest_push_days": 160,
        "oldest_push_days": 161,
        "repository_uri": "106059658660.dkr.ecr.us-east-1.amazonaws.com/ai-course-creator-app",
        "note": "upper bound: ECR bills for unique layers, and images sharing a base layer are counted once each here. A stale repository may still be pulled from -- the push date says nothing about pulls",
        "approximate_reason": "shared-layers"
      }
    },
    {
      "check": "unused-route53-zone",
      "resource_id": "Z0457877ZLNZ0EMC9ERY",
      "resource_type": "route53-hosted-zone",
      "region": "global",
      "reason": "Private hosted zone agent.local. holds only the 2 record set(s) Route 53 creates with a zone, so it resolves nothing; it belongs to Cloud Map namespace ns-kyjziaevjp3dv2ua, which registers nothing",
      "monthly_cost": 0.5,
      "approximate_cost": false,
      "remediation": "aws servicediscovery delete-namespace --id ns-kyjziaevjp3dv2ua --region us-east-1",
      "details": {
        "name": "agent.local.",
        "private": true,
        "record_set_count": 2,
        "zones_in_account": 1,
        "priced_as": "first_25",
        "comment": "Created by AWS Cloud Map namespace with ARN arn:aws:servicediscovery:us-east-1:106059658660:namespace/ns-kyjziaevjp3dv2ua",
        "cloud_map_namespace": "ns-kyjziaevjp3dv2ua",
        "cloud_map_region": "us-east-1",
        "note": "Cloud Map owns this zone. Delete the namespace, not the zone: delete-hosted-zone leaves the namespace behind pointing at nothing. delete-namespace refuses while any service is still registered in it, even one with no instances"
      }
    },
    {
      "check": "ecr-stale-images",
      "resource_id": "ai-course-creator-orchestrator",
      "resource_type": "ecr-repository",
      "region": "us-east-1",
      "reason": "26 image(s) holding up to 4.79 GB; nothing pushed in 160 days, 25 untagged",
      "monthly_cost": 0.48,
      "approximate_cost": true,
      "remediation": "aws ecr describe-images --repository-name ai-course-creator-orchestrator --region us-east-1  # review, then delete the tags you do not need and add a lifecycle policy so they do not come back",
      "details": {
        "image_count": 26,
        "untagged_count": 25,
        "total_gb": 4.791,
        "newest_push_days": 160,
        "oldest_push_days": 161,
        "repository_uri": "106059658660.dkr.ecr.us-east-1.amazonaws.com/ai-course-creator-orchestrator",
        "note": "upper bound: ECR bills for unique layers, and images sharing a base layer are counted once each here. A stale repository may still be pulled from -- the push date says nothing about pulls",
        "approximate_reason": "shared-layers"
      }
    },
    {
      "check": "ecr-stale-images",
      "resource_id": "course-creator-stack",
      "resource_type": "ecr-repository",
      "region": "us-east-1",
      "reason": "21 image(s) holding up to 4.71 GB; nothing pushed in 149 days, 20 untagged",
      "monthly_cost": 0.47,
      "approximate_cost": true,
      "remediation": "aws ecr describe-images --repository-name course-creator-stack --region us-east-1  # review, then delete the tags you do not need and add a lifecycle policy so they do not come back",
      "details": {
        "image_count": 21,
        "untagged_count": 20,
        "total_gb": 4.71,
        "newest_push_days": 149,
        "oldest_push_days": 149,
        "repository_uri": "106059658660.dkr.ecr.us-east-1.amazonaws.com/course-creator-stack",
        "note": "upper bound: ECR bills for unique layers, and images sharing a base layer are counted once each here. A stale repository may still be pulled from -- the push date says nothing about pulls",
        "approximate_reason": "shared-layers"
      }
    },
    {
      "check": "ecr-stale-images",
      "resource_id": "ai-course-creator-judge",
      "resource_type": "ecr-repository",
      "region": "us-east-1",
      "reason": "26 image(s) holding up to 4.41 GB; nothing pushed in 160 days, 25 untagged",
      "monthly_cost": 0.44,
      "approximate_cost": true,
      "remediation": "aws ecr describe-images --repository-name ai-course-creator-judge --region us-east-1  # review, then delete the tags you do not need and add a lifecycle policy so they do not come back",
      "details": {
        "image_count": 26,
        "untagged_count": 25,
        "total_gb": 4.414,
        "newest_push_days": 160,
        "oldest_push_days": 161,
        "repository_uri": "106059658660.dkr.ecr.us-east-1.amazonaws.com/ai-course-creator-judge",
        "note": "upper bound: ECR bills for unique layers, and images sharing a base layer are counted once each here. A stale repository may still be pulled from -- the push date says nothing about pulls",
        "approximate_reason": "shared-layers"
      }
    },
    {
      "check": "ecr-stale-images",
      "resource_id": "ai-course-creator-researcher",
      "resource_type": "ecr-repository",
      "region": "us-east-1",
      "reason": "26 image(s) holding up to 4.41 GB; nothing pushed in 160 days, 25 untagged",
      "monthly_cost": 0.44,
      "approximate_cost": true,
      "remediation": "aws ecr describe-images --repository-name ai-course-creator-researcher --region us-east-1  # review, then delete the tags you do not need and add a lifecycle policy so they do not come back",
      "details": {
        "image_count": 26,
        "untagged_count": 25,
        "total_gb": 4.414,
        "newest_push_days": 160,
        "oldest_push_days": 161,
        "repository_uri": "106059658660.dkr.ecr.us-east-1.amazonaws.com/ai-course-creator-researcher",
        "note": "upper bound: ECR bills for unique layers, and images sharing a base layer are counted once each here. A stale repository may still be pulled from -- the push date says nothing about pulls",
        "approximate_reason": "shared-layers"
      }
    },
    {
      "check": "ecr-stale-images",
      "resource_id": "ai-course-creator-content-builder",
      "resource_type": "ecr-repository",
      "region": "us-east-1",
      "reason": "26 image(s) holding up to 4.41 GB; nothing pushed in 160 days, 25 untagged",
      "monthly_cost": 0.44,
      "approximate_cost": true,
      "remediation": "aws ecr describe-images --repository-name ai-course-creator-content-builder --region us-east-1  # review, then delete the tags you do not need and add a lifecycle policy so they do not come back",
      "details": {
        "image_count": 26,
        "untagged_count": 25,
        "total_gb": 4.414,
        "newest_push_days": 160,
        "oldest_push_days": 161,
        "repository_uri": "106059658660.dkr.ecr.us-east-1.amazonaws.com/ai-course-creator-content-builder",
        "note": "upper bound: ECR bills for unique layers, and images sharing a base layer are counted once each here. A stale repository may still be pulled from -- the push date says nothing about pulls",
        "approximate_reason": "shared-layers"
      }
    },
    {
      "check": "ecr-stale-images",
      "resource_id": "biometric-scout",
      "resource_type": "ecr-repository",
      "region": "us-east-1",
      "reason": "18 image(s) holding up to 3.81 GB; nothing pushed in 149 days, 17 untagged",